{
  "$schema": "https://paperandslate.org/schemas/eom/1.0/modules/event-catalog.schema.json",
  "canonical": "https://ecme-high.example/eom/events.json",
  "expires": "2028-05-01T14:00:00Z",
  "extensions": { "https://fixture.example/eom/extensions/module-test": { "value": "preserved" } },
  "id": "https://ecme-high.example/eom/resource/events",
  "items": [
    {
      "eventType": "open-house",
      "id": "https://ecme-high.example/id/event/open-house",
      "name": "Open House",
      "start": "2027-09-10T18:00:00-07:00",
      "timeZone": "America/Los_Angeles",
      "type": "event"
    }
  ],
  "modified": "2027-05-01T14:00:00Z",
  "specification": "https://paperandslate.org/spec/eom/1.0",
  "subjects": ["https://ecme-high.example/id/school"],
  "type": "event-catalog",
  "version": "1.0"
}
