{
  "$schema": "https://paperandslate.org/schemas/eom/1.0/modules/program-catalog.schema.json",
  "canonical": "https://ecme-high.example/eom/programs.json",
  "catalogVersion": {
    "effective": {
      "from": "2027-07-01",
      "until": "2028-06-30"
    },
    "id": "https://ecme-high.example/id/catalog/2027-2028",
    "label": "2027–2028",
    "public": true,
    "status": "active"
  },
  "defaultLanguage": "en-US",
  "expires": "2028-05-01T14:00:00Z",
  "id": "https://ecme-high.example/eom/resource/programs",
  "items": [
    {
      "campuses": [
        {
          "id": "https://ecme-high.example/id/campus/main"
        }
      ],
      "classification": "career-pathway",
      "departments": [
        {
          "id": "https://ecme-high.example/id/department/fcs"
        }
      ],
      "description": "A synthetic culinary sequence combining food production, design, and service.",
      "duration": "three years",
      "educationLevels": [
        "grade-10",
        "grade-11",
        "grade-12"
      ],
      "id": "https://ecme-high.example/id/program/culinary-hospitality",
      "modes": [
        "in-person",
        "lab"
      ],
      "name": "Culinary and Hospitality Pathway",
      "outcomes": [
        {
          "level": "pathway",
          "statement": "Plan and communicate a safe public food-service project."
        }
      ],
      "provider": {
        "id": "https://ecme-high.example/id/school"
      },
      "requirements": [
        {
          "courses": [
            {
              "id": "https://ecme-high.example/id/course/fcs-101"
            },
            {
              "id": "https://ecme-high.example/id/course/cul-101"
            },
            {
              "id": "https://ecme-high.example/id/course/cul-202"
            }
          ],
          "kind": "all"
        }
      ],
      "stages": [
        {
          "courses": [
            {
              "id": "https://ecme-high.example/id/course/fcs-101"
            }
          ],
          "order": 1
        },
        {
          "courses": [
            {
              "id": "https://ecme-high.example/id/course/cul-101"
            }
          ],
          "order": 2
        },
        {
          "choose": {
            "courses": [
              {
                "id": "https://ecme-high.example/id/course/cul-202"
              },
              {
                "id": "https://ecme-high.example/id/course/cul-250"
              }
            ],
            "kind": "choose",
            "minimum": 1
          },
          "order": 3
        }
      ],
      "totalCredits": [
        {
          "system": "https://ecme-high.example/id/credit-system/local",
          "value": "2.5"
        }
      ],
      "type": "program"
    },
    {
      "campuses": [
        {
          "id": "https://ecme-high.example/id/campus/main"
        }
      ],
      "classification": "pathway",
      "departments": [
        {
          "id": "https://ecme-high.example/id/department/mathematics"
        },
        {
          "id": "https://ecme-high.example/id/department/science"
        },
        {
          "id": "https://ecme-high.example/id/department/engineering-technology"
        }
      ],
      "description": "A synthetic pathway connecting mathematics, science, engineering, and computing.",
      "duration": "three years",
      "educationLevels": [
        "grade-10",
        "grade-11",
        "grade-12"
      ],
      "id": "https://ecme-high.example/id/program/stem",
      "modes": [
        "in-person",
        "lab"
      ],
      "name": "STEM Pathway",
      "outcomes": [
        {
          "level": "pathway",
          "statement": "Explain a public STEM project using evidence and technical communication."
        }
      ],
      "provider": {
        "id": "https://ecme-high.example/id/school"
      },
      "requirements": [
        {
          "courses": [
            {
              "id": "https://ecme-high.example/id/course/mat-301"
            },
            {
              "id": "https://ecme-high.example/id/course/sci-301"
            }
          ],
          "kind": "all"
        },
        {
          "courses": [
            {
              "id": "https://ecme-high.example/id/course/eng-251"
            },
            {
              "id": "https://ecme-high.example/id/course/cse-201"
            }
          ],
          "display": "Choose one technology concentration course.",
          "kind": "choose",
          "minimum": 1
        }
      ],
      "stages": [
        {
          "courses": [
            {
              "id": "https://ecme-high.example/id/course/mat-101"
            },
            {
              "id": "https://ecme-high.example/id/course/sci-101"
            }
          ],
          "order": 1
        },
        {
          "choose": {
            "courses": [
              {
                "id": "https://ecme-high.example/id/course/eng-201"
              },
              {
                "id": "https://ecme-high.example/id/course/cse-201"
              }
            ],
            "kind": "choose",
            "minimum": 1
          },
          "order": 2
        }
      ],
      "totalCredits": [
        {
          "system": "https://ecme-high.example/id/credit-system/local",
          "value": "4.0"
        }
      ],
      "type": "program"
    }
  ],
  "modified": "2027-05-01T14:00:00Z",
  "releaseStatus": "active",
  "specification": "https://paperandslate.org/spec/eom/1.0",
  "subjects": [
    "https://ecme-high.example/id/school"
  ],
  "type": "program-catalog",
  "version": "1.0"
}
