{
  "$schema": "https://paperandslate.org/schemas/eom/1.0/modules/campus-catalog.schema.json",
  "canonical": "https://ecme-high.example/eom/campuses.json",
  "expires": "2028-05-01T14:00:00Z",
  "id": "https://ecme-high.example/eom/resource/campuses",
  "items": [
    {
      "campusType": "secondary-school",
      "id": "https://ecme-high.example/id/campus/main",
      "name": "Main Campus",
      "type": "campus",
      "virtuality": "physical"
    }
  ],
  "modified": "2027-05-01T14:00:00Z",
  "specification": "https://paperandslate.org/spec/eom/1.0",
  "subjects": [
    "https://ecme-high.example/id/school"
  ],
  "type": "campus-catalog",
  "version": "1.0"
}
